Company Name,Job Title,Min Wage,Max Wage,Average Wage,Job Count
JPMORGAN CHASE & CO,EXECUTIVE DIRECTOR CLIENT MANAGEMENT,325000,350000,337500.0,2
JPMORGAN CHASE & CO,EXECUTIVE DIRECTOR ORIGINATION CLIENT MANAGER,325000,325000,325000.0,1
JPMORGAN CHASE & CO,EXECUTIVE DIRECTOR SR DIRECTOR OF SOFTWARE ENGINEERING,325000,325000,325000.0,1
JPMORGAN CHASE & CO,VICE PRESIDENT CLIENT MANAGEMENT,285000,285000,285000.0,1
JPMORGAN CHASE & CO,EXECUTIVE DIRECTOR DATA SCIENCE,275000,275000,275000.0,1
JPMORGAN CHASE & CO,EXECUTIVE DIRECTOR APPLIED AI ML DIRECTOR,260000,260000,260000.0,1
JPMORGAN CHASE & CO,VICE PRESIDENT TRADER,260000,260000,260000.0,1
JPMORGAN CHASE & CO,EXECUTIVE DIRECTOR SOFTWARE ENGINEERING,260000,260000,260000.0,1
JPMORGAN CHASE & CO,EXECUTIVE DIRECTOR STRATEGY MANAGER SENIOR,260000,260000,260000.0,1
JPMORGAN CHASE & CO,VICE PRESIDENT BUSINESS MANAGEMENT,260000,260000,260000.0,1
JPMORGAN CHASE & CO,EXECUTIVE DIRECTOR PRODUCT MANAGEMENT,245000,245000,245000.0,1
JPMORGAN CHASE & CO,EXECUTIVE DIRECTOR QUANT ANALYTICS,210000,260000,235000.0,2
JPMORGAN CHASE & CO,VICE PRESIDENT INVESTMENT BANKING,225000,225000,225000.0,1
JPMORGAN CHASE & CO,VICE PRESIDENT SENIOR LEAD ARCHITECT,225000,225000,225000.0,1
JPMORGAN CHASE & CO,VICE PRESIDENT ORIGINATION AND CLIENT MANAGER,225000,225000,225000.0,1
JPMORGAN CHASE & CO,EXECUTIVE DIRECTOR RESEARCH ANALYST,225000,225000,225000.0,1
JPMORGAN CHASE & CO,EMARKETS VP,215000,215000,215000.0,1
JPMORGAN CHASE & CO,VICE PRESIDENT SR LEAD SECURITY ENGINEER,215000,215000,215000.0,1
JPMORGAN CHASE & CO,EXEC DIR DIRECTOR OF SOFTWARE ENGINEERING,215000,215000,215000.0,1
JPMORGAN CHASE & CO,VICE PRESIDENT SR LEAD ARCHITECT,180000,235000,207500.0,2
JPMORGAN CHASE & CO,VICE PRESIDENT ORIGINATION CLIENT MANAGEMENT,205000,205000,205000.0,1
JPMORGAN CHASE & CO,VICE PRESIDENT QUANTITATIVE RESEARCH,200000,200000,200000.0,2
JPMORGAN CHASE & CO,ASSOCIATE E MARKETS ASSOCIATE,200000,200000,200000.0,1
JPMORGAN CHASE & CO,VICE PRESIDENT PROJECT EXECUTION,200000,200000,200000.0,1
JPMORGAN CHASE & CO,ASSOCIATE CIB ASSOC S&T,200000,200000,200000.0,1
JPMORGAN CHASE & CO,ASSOCIATE CIB ASSOC S AND T,200000,200000,200000.0,1
JPMORGAN CHASE & CO,ASSOCIATE INVESTMENT BANK TRADING,200000,200000,200000.0,1
JPMORGAN CHASE & CO,VICE PRESIDENT PRODUCT DELIVERY MANAGER,194000,194000,194000.0,1
JPMORGAN CHASE & CO,VICE PRESIDENT AI RESEARCH LEAD,193800,193800,193800.0,1
JPMORGAN CHASE & CO,VICE PRESIDENT APPLIED AI ML LEAD,168000,215000,191500.0,2
JPMORGAN CHASE & CO,VICE PRESIDENT LEAD BUSINESS ANALYST AND PROJECT MANAGER,190000,190000,190000.0,1
JPMORGAN CHASE & CO,MANAGER ASSET LIABILITY MANAGEMENT,190000,190000,190000.0,1
JPMORGAN CHASE & CO,VICE PRESIDENT SR LEAD DATA ARCHITECT,189700,189700,189700.0,1
JPMORGAN CHASE & CO,VICE PRESIDENT SENIOR MANAGER OF SOFTWARE ENGINEERING,172900,200400,186650.0,2
JPMORGAN CHASE & CO,VP SR MANAGER OF SOFTWARE ENGINEERING,185000,185000,185000.0,1
JPMORGAN CHASE & CO,VICE PRESIDENT SOLUTION ARCHITECT,185000,185000,185000.0,1
JPMORGAN CHASE & CO,VICE PRESIDENT SENIOR MANAGER OF SOFTWARE ENGINEE,185000,185000,185000.0,1
JPMORGAN CHASE & CO,VICE PRESIDENT SITE RELIABILITY ENGINEER,182000,185000,183500.0,2
JPMORGAN CHASE & CO,VICE PRESIDENT PROCESS IMPROVEMENT MANAGER,180000,180000,180000.0,1
JPMORGAN CHASE & CO,VICE PRESIDENT INFORMATION SECURITY,180000,180000,180000.0,1
JPMORGAN CHASE & CO,VICE PRESIDENT USER EXPERIENCE RESEARCHER,180000,180000,180000.0,1
JPMORGAN CHASE & CO,VICE PRESIDENT PRODUCT OWNER,180000,180000,180000.0,1
JPMORGAN CHASE & CO,VICE PRESIDENT TECH SENIOR AUDITOR,180000,180000,180000.0,1
JPMORGAN CHASE & CO,VICE PRESIDENT LEAD SITE RELIABILITY ENGINEER,180000,180000,180000.0,1
JPMORGAN CHASE & CO,VICE PRESIDENT MANAGER OF SOFTWARE ENGINEERING,145000,287700,178950.0,8
JPMORGAN CHASE & CO,VICE PRESIDENT BUSINESS TRANSFORMATION,175000,175000,175000.0,1
JPMORGAN CHASE & CO,ASSOCIATE INVESTMENT GRADE FINANCE,175000,175000,175000.0,1
JPMORGAN CHASE & CO,ASSOCIATE QUANTITATIVE RESEARCH – CREDIT MARKETS,175000,175000,175000.0,1
JPMORGAN CHASE & CO,ASSOCIATE INVESTMENT BANKING,175000,175000,175000.0,1
JPMORGAN CHASE & CO,VICE PRESIDENT SR MANAGER OF SOFTWARE ENGINEERING,150000,195100,173063.63636363635,11
JPMORGAN CHASE & CO,VICE PRESIDENT LEAD DATA ENGINEER,165700,180000,172850.0,2
JPMORGAN CHASE & CO,VICE PRESIDENT DATA MANAGEMENT,120900,205000,172800.0,3
JPMORGAN CHASE & CO,VICE PRESIDENT ARCHITECTURE,172000,172000,172000.0,2
JPMORGAN CHASE & CO,VICE PRESIDENT BUSINESS ANALYST,149000,192000,170500.0,2
JPMORGAN CHASE & CO,VICE PRESIDENT VALUATION CONTROLLER,170000,170000,170000.0,1
JPMORGAN CHASE & CO,EXECUTIVE DIRECTOR,170000,170000,170000.0,1
JPMORGAN CHASE & CO,VICE PRESIDENT AUDIT DIRECTOR,170000,170000,170000.0,1
JPMORGAN CHASE & CO,VICE PRESIDENT INVESTMENT SPECIALIST,170000,170000,170000.0,1
JPMORGAN CHASE & CO,VICE PRESIDENT PREDICTIVE SCIENCE,169000,169000,169000.0,1
JPMORGAN CHASE & CO,VICE PRESIDENT SENIOR LEAD SOFTWARE ENGINEER,135900,187800,167960.0,5
JPMORGAN CHASE & CO,ASSOCIATE APPLIED AI ML ASSOCIATE SR,166920,166920,166920.0,1
JPMORGAN CHASE & CO,VICE PRESIDENT SECURITIES VALUATION,166500,166500,166500.0,1
JPMORGAN CHASE & CO,VICE PRESIDENT SENIOR LEAD SITE RELIABILITY ENGIN,165000,165000,165000.0,1
JPMORGAN CHASE & CO,VICE PRESIDENT SR LEAD SITE RELIABILITY ENGINEER,165000,165000,165000.0,1
JPMORGAN CHASE & CO,VICE PRESIDENT SECURITY ENGINEERING,165000,165000,165000.0,1
JPMORGAN CHASE & CO,VICE PRESIDENT SR LEAD SOFTWARE ENGINEER,133000,245000,164619.20833333334,24
JPMORGAN CHASE & CO,VICE PRESIDENT BUSINESS ANALYSIS,163238,163238,163238.0,1
JPMORGAN CHASE & CO,ESG DATA MANAGEMENT LEAD,162573,162573,162573.0,1
JPMORGAN CHASE & CO,ASSOCIATE LEAD SOFTWARE ENGINEER,155000,170000,162500.0,2
JPMORGAN CHASE & CO,VICE PRESIDENT DIGITAL PRODUCTS,162000,162000,162000.0,1
JPMORGAN CHASE & CO,SENIOR SOFTWARE ENGINEER,161500,161500,161500.0,1
JPMORGAN CHASE & CO,VICE PRESIDENT PORTFOLIO MANAGEMENT,161500,161500,161500.0,1
JPMORGAN CHASE & CO,SITE RELIABILITY ENGINEER,147500,175000,161250.0,2
JPMORGAN CHASE & CO,DATA SCIENTIST SR ASSOCIATE,160000,160000,160000.0,1
JPMORGAN CHASE & CO,VICE PRESIDENT CONFLICTS MANAGEMENT,160000,160000,160000.0,1
JPMORGAN CHASE & CO,VICE PRESIDENT MARKET RISK COVERAGE LEAD,160000,160000,160000.0,1
JPMORGAN CHASE & CO,VICE PRESIDENT MARKET RISK GOVERNANCE LEAD,160000,160000,160000.0,1
JPMORGAN CHASE & CO,ASSOCIATE APPLIED AI AND ML,160000,160000,160000.0,1
JPMORGAN CHASE & CO,VICE PRESIDENT SOFTWARE ENGINEERING,118700,205000,158121.45283018867,53
JPMORGAN CHASE & CO,VICE PRESIDENT SOFTWARE ENGINEER,120000,250000,157516.46808510637,47
JPMORGAN CHASE & CO,VICE PRESIDENT ARCHITECT,155000,160000,157500.0,2
JPMORGAN CHASE & CO,VICE PRESIDENT SENIOR AUDITOR,156000,156000,156000.0,1
JPMORGAN CHASE & CO,ASSOCIATE QUANTITATIVE RESEARCH,150000,160000,155000.0,2
JPMORGAN CHASE & CO,VICE PRESIDENT DATA VISUALIZATION MANAGER,155000,155000,155000.0,1
JPMORGAN CHASE & CO,VICE PRESIDENT LEAD SOFTWARE ENGINEER,118000,245000,154613.27884615384,104
JPMORGAN CHASE & CO,VICE PRESIDENT,135000,160000,151666.66666666666,3
JPMORGAN CHASE & CO,VICE PRESIDENT DATA SCIENTIST LEAD,112000,190000,151000.0,2
JPMORGAN CHASE & CO,APPLIED AI ML ASSOCIATE SENIOR,150000,150000,150000.0,1
JPMORGAN CHASE & CO,ASSOCIATE INVESTOR,150000,150000,150000.0,1
JPMORGAN CHASE & CO,ASSOCIATE INVESTMENT SPECIALIST,150000,150000,150000.0,1
JPMORGAN CHASE & CO,ASSOCIATE QUANT RESEARCH,150000,150000,150000.0,1
JPMORGAN CHASE & CO,ASSOCIATE CIB RISK ASSOCIATE,150000,150000,150000.0,1
JPMORGAN CHASE & CO,VICE PRESIDENT SR MANAGER OF SOFTWARE ENGINEERIN,150000,150000,150000.0,1
JPMORGAN CHASE & CO,VICE PRESIDENT QUANT MODELING LEAD,135200,160000,147600.0,2
JPMORGAN CHASE & CO,VICE PRESIDENT PRODUCT DEVELOPMENT,130000,164900,147450.0,2
JPMORGAN CHASE & CO,VICE PRESIDENT PRODUCT MANAGER,126800,169100,146233.33333333334,3
JPMORGAN CHASE & CO,VICE PRESIDENT SALESFORCE ENGINEER,145000,145000,145000.0,1
JPMORGAN CHASE & CO,VICE PRESIDENT SIRR LEAD,145000,145000,145000.0,1
JPMORGAN CHASE & CO,ASSOCIATE DATA OWNER ASSOCIATE SR,145000,145000,145000.0,1
JPMORGAN CHASE & CO,ASSOCIATE APPLIED AI & MACHINE LEARNING,145000,145000,145000.0,1
JPMORGAN CHASE & CO,VICE PRESIDENT APPLICATIONS SUPPORT,137400,151000,144875.0,4
JPMORGAN CHASE & CO,PRODUCT MANAGER,143685,143685,143685.0,1
JPMORGAN CHASE & CO,VICE PRESIDENT LEAD INFRASTRUCTURE ENGINEER,130410,156000,143205.0,2
JPMORGAN CHASE & CO,SOFTWARE ENGINEER III,135400,156500,142433.33333333334,3
JPMORGAN CHASE & CO,VICE PRESIDENT INFRASTRUCTURE ENGINEERING,123600,159000,141300.0,2
JPMORGAN CHASE & CO,VICE PRESIDENT QUANT ANALYTICS MANAGER,140000,140000,140000.0,1
JPMORGAN CHASE & CO,SOFTWARE ENGINEERING LEAD,140000,140000,140000.0,1
JPMORGAN CHASE & CO,ASSOCIATE PRODUCT OWNER,140000,140000,140000.0,2
JPMORGAN CHASE & CO,VICE PRESIDENT PROGRAM AND PRODUCT MANAGER,140000,140000,140000.0,1
JPMORGAN CHASE & CO,DATA SCIENTIST ASSOCIATE SR,140000,140000,140000.0,1
JPMORGAN CHASE & CO,TRADING AND STRUCTURING ASSOCIATE,140000,140000,140000.0,1
JPMORGAN CHASE & CO,VICE PRESIDENT LEAD ARCHITECT,140000,140000,140000.0,1
JPMORGAN CHASE & CO,LEAD SOFTWARE ENGINEER,140000,140000,140000.0,1
JPMORGAN CHASE & CO,JAVA SOFTWARE ENGINEER LEAD,136000,136000,136000.0,1
JPMORGAN CHASE & CO,ASSOCIATE DATA OWNER,135000,135000,135000.0,1
JPMORGAN CHASE & CO,QUANT ANALYTICS SR ASSOCIATE,125000,145000,135000.0,2
JPMORGAN CHASE & CO,SENIOR ASSOCIATE QUANTITATIVE ANALYTICS,135000,135000,135000.0,1
JPMORGAN CHASE & CO,VICE PRESIDENT DATABASE MANAGEMENT LEAD,135000,135000,135000.0,1
JPMORGAN CHASE & CO,VICE PRESIDENT STRATEGIC ANALYTICS,135000,135000,135000.0,1
JPMORGAN CHASE & CO,ASSOCIATE INSTITUTIONAL STRATEGY,135000,135000,135000.0,1
JPMORGAN CHASE & CO,ASSOCIATE DATA ENGINEERING,133100,133100,133100.0,1
JPMORGAN CHASE & CO,VICE PRESIDENT APPLICATION SUPPORT ENGINEER,133100,133100,133100.0,1
JPMORGAN CHASE & CO,VICE PRESIDENT DATABASE ANALYST,133000,133000,133000.0,1
JPMORGAN CHASE & CO,ASSOCIATE MODEL RISK GOVERNANCE AND REVIEW,132500,132500,132500.0,1
JPMORGAN CHASE & CO,ASSOCIATE DATA SCIENTIST,120000,161600,131320.0,5
JPMORGAN CHASE & CO,ASSOCIATE SOFTWARE ENGINEER III,109200,180000,130426.58333333333,60
JPMORGAN CHASE & CO,ASSOCIATE INFRASTRUCTURE ENGINEER,130100,130100,130100.0,2
JPMORGAN CHASE & CO,VICE PRESIDENT TREASURY,130000,130000,130000.0,1
JPMORGAN CHASE & CO,AI DEVELOPER,130000,130000,130000.0,1
JPMORGAN CHASE & CO,DATA MANAGEMENT ASSOCIATE SENIOR,129675,129675,129675.0,1
JPMORGAN CHASE & CO,ASSOCIATE QUANTITATIVE MODELING,119000,140000,128875.0,4
JPMORGAN CHASE & CO,ASSOCIATE SOFTWARE ENGINEER,101300,160000,127230.07352941176,68
JPMORGAN CHASE & CO,VICE PRESIDENT SCRUM MASTER,127150,127150,127150.0,1
JPMORGAN CHASE & CO,VICE PRESIDENT AGILITY LEAD,127000,127000,127000.0,1
JPMORGAN CHASE & CO,ASSOCIATE SOFTWARE ENGINEERING,99400,150700,125140.0,30
JPMORGAN CHASE & CO,QUANT ANALYTICS MANAGER,125000,125000,125000.0,1
JPMORGAN CHASE & CO,ASSOCIATE INFRASTRUCTURE ENGINEER II,125000,125000,125000.0,1
JPMORGAN CHASE & CO,ASSOCIATE PRODUCT CONTROLLER,125000,125000,125000.0,1
JPMORGAN CHASE & CO,VICE PRESIDENT PROGRAM PROJECT MANAGER,125000,125000,125000.0,1
JPMORGAN CHASE & CO,ASSOCIATE SR USER EXPERIENCE DESIGNER,125000,125000,125000.0,1
JPMORGAN CHASE & CO,QUANTITATIVE RESEARCH ASSOCIATE,125000,125000,125000.0,1
JPMORGAN CHASE & CO,SOFTWARE ENGINEER,95000,155000,124872.22222222222,18
JPMORGAN CHASE & CO,ASSOCIATE DATA SCIENTIST ASSOCIATE SR,110000,137500,124166.66666666667,3
JPMORGAN CHASE & CO,SECURITY ENGINEER,124000,124000,124000.0,1
JPMORGAN CHASE & CO,ASSOCIATE CREDIT RISK,120000,120000,120000.0,1
JPMORGAN CHASE & CO,VICE PRESIDENT INFRASTRUCTURE DEVELOPER,120000,120000,120000.0,1
JPMORGAN CHASE & CO,ASSOCIATE QUANT MODELING ASSOC,120000,120000,120000.0,1
JPMORGAN CHASE & CO,ASSOCIATE PROCESS IMPROVEMENT,118939,118939,118939.0,1
JPMORGAN CHASE & CO,ASSOCIATE INFRASTRUCTURE ENGINEERING,117700,117700,117700.0,1
JPMORGAN CHASE & CO,ASSOCIATE SOFTWARE ENGINEER II,109500,125000,117250.0,2
JPMORGAN CHASE & CO,ASSOCIATE DATABASE MANAGEMENT,117000,117000,117000.0,1
JPMORGAN CHASE & CO,ASSOCIATE QUANT ANALYTICS,95000,140000,116625.0,4
JPMORGAN CHASE & CO,ASSOCIATE APPLICATIONS SUPPORT,106600,128000,115683.33333333333,6
JPMORGAN CHASE & CO,ASSOCIATE STRATEGIC BUSINESS ANALYST II,115300,115300,115300.0,1
JPMORGAN CHASE & CO,ASSOCIATE,71300,175000,115157.14285714286,7
JPMORGAN CHASE & CO,DATA SCIENTIST SENIOR ASSOCIATE,115000,115000,115000.0,1
JPMORGAN CHASE & CO,BUSINESS ANALYST,115000,115000,115000.0,1
JPMORGAN CHASE & CO,VICE PRESIDENT BUSINESS SYSTEMS MANAGER,113600,113600,113600.0,1
JPMORGAN CHASE & CO,SOFTWARE ENGINEERING,101000,120000,113200.0,3
JPMORGAN CHASE & CO,VICE PRESIDENT PRODUCT MANAGER SR,112000,112000,112000.0,1
JPMORGAN CHASE & CO,ASSOCIATE EXTERNAL REPORTING CONTROLLER,111909,111909,111909.0,1
JPMORGAN CHASE & CO,BIG DATA ENGINEER,110800,110800,110800.0,1
JPMORGAN CHASE & CO,ASSOCIATE PROJECT MANAGER,110000,110000,110000.0,1
JPMORGAN CHASE & CO,ASSOCIATE DATA VISUALIZATION,110000,110000,110000.0,1
JPMORGAN CHASE & CO,ASSOCIATE PROCESS IMPROVEMENT ASSOC II,110000,110000,110000.0,1
JPMORGAN CHASE & CO,TRADING SERVICES ASSOCIATE II,108000,108000,108000.0,1
JPMORGAN CHASE & CO,ASSOCIATE SRE III,106558,106558,106558.0,2
JPMORGAN CHASE & CO,PRODUCT DEVELOPMENT ASSOCIATE,106000,106000,106000.0,1
JPMORGAN CHASE & CO,QUANT ANALYTICS ASSOCIATE SR,98000,107000,104000.0,3
JPMORGAN CHASE & CO,VICE PRESIDENT FINANCIAL CONTROLLER,103500,103500,103500.0,3
JPMORGAN CHASE & CO,APPLICATION SUPPORT,100000,100000,100000.0,1
JPMORGAN CHASE & CO,SENIOR PRODUCT ANALYST,99960,99960,99960.0,1
JPMORGAN CHASE & CO,ASSOCIATE ANALYTICS SOLUTIONS & DELIVERY,99500,99500,99500.0,1
JPMORGAN CHASE & CO,ANALYST,85000,121000,98666.66666666667,3
JPMORGAN CHASE & CO,ASSOCIATE SENIOR AUDITOR,86500,110000,98250.0,2
JPMORGAN CHASE & CO,ASSOCIATE RISK ANALYTICS MODELING,97250,97250,97250.0,1
JPMORGAN CHASE & CO,RISK STRATEGIC ANALYTICS ASSOCIATE,95000,95000,95000.0,1
JPMORGAN CHASE & CO,OPERATIONS OVERSIGHT,91000,91000,91000.0,1
JPMORGAN CHASE & CO,ASSOCIATE LATAM SYNDICATE LOAN COORDINATOR,90000,90000,90000.0,1
JPMORGAN CHASE & CO,INVESTMENT BANKING ANALYST,85000,90000,87500.0,2
JPMORGAN CHASE & CO,ASSOCIATE BUSINESS ANALYSIS & REPORTING,85494,85494,85494.0,1
JPMORGAN CHASE & CO,HEDGE COMPLIANCE,85000,85000,85000.0,1
JPMORGAN CHASE & CO,ASSOCIATE PRIVATE EQUITY AND REAL ESTATE SERVICES,83300,83300,83300.0,1
JPMORGAN CHASE & CO,STRATEGIC ANALYTICS,82000,82000,82000.0,1
JPMORGAN CHASE & CO,ASSOCIATE SR MARKETING FINANCE,80000,80000,80000.0,1
JPMORGAN CHASE & CO,TRADE LIFECYCLE ANALYST,72363,72363,72363.0,1
JPMORGAN CHASE & CO,ANALYST RETAINED LENDING FINANCIAL CONTROL,68500,68500,68500.0,1
