Company Name,Job Title,Min Wage,Max Wage,Average Wage,Job Count
KOHLER COMPANY,SR SOFTWARE QUALITY ENGINEER,159000,159000,159000,1
KOHLER COMPANY,SR DIGITAL ARCHITECT,141315,141315,141315,1
KOHLER COMPANY,SR PROJECT ENGINEER APPLICATIONS,129189,129189,129189,1
KOHLER COMPANY,PRINCIPAL ENGINEER GAS ENGINES AMERICAS,119450,119450,119450,1
KOHLER COMPANY,LEAD UX DESIGNER KOHLER VENTURES,110050,110050,110050,1
KOHLER COMPANY,ASSURANCE AND ADVISORY SERVICES MANAGER,106475,106475,106475,1
KOHLER COMPANY,STAFF ENGINEER – ELECTRONICS TESTING,96300,96300,96300,1
